<?xml version="1.0" encoding="utf-8"?>
<!DOCTYPE formulationpatterns PUBLIC "-//LISp-Miner//DTD AR2NL 1.2//EN"
	"http://lispminer.vse.cz/dtd/ar2nl-1.2.dtd">

<formulationpatterns>

<!-- formulation patterns for Founded Implication -->

<fp id="fp1" quantifier="FUI" numofant="1+" numofsuc="1+" numofcon="0">
  01. <fpa symbol="X"/> <ename symbol="Eptc0" case="2" number="pl"/>
  <ename symbol="E" case="2" number="pl"/>
  potvrzuje tuto závislost: jestliže <floatslot id="1" role="A" occno="first"/>
  <ename symbol="E"/>
  <literal role="A" typeofphrase="V"/>, pak
  <floatslot id="1" role="S" occno="first"/>
  <optionaltext>
    <choosetext>
      <variant>také</variant>
      <variant>rovněž</variant>
    </choosetext>
  </optionaltext>
  <literal role="S" typeofphrase="V"/>.
</fp>

<fp id="fp2" quantifier="FUI" numofant="1+" numofsuc="1+" numofcon="1+">
  02. <fpa symbol="X"/> <ename symbol="Eptc0" case="2" number="pl"/>
  <ename symbol="E" case="2" number="pl"/>
  potvrzuje tuto závislost: jestliže <floatslot id="1" role="A" occno="first"/>
  <ename symbol="E"/>
  <literal role="A" typeofphrase="V"/>, pak
  <floatslot id="1" role="S" occno="first"/>
  <optionaltext>
    <choosetext>
      <variant>také</variant>
      <variant>rovněž</variant>
    </choosetext>
  </optionaltext>
  <literal role="S" typeofphrase="V"/>.
  <fpa symbol="C"/>
</fp>


<fp id="fp3" quantifier="FUI" numofant="1+" numofsuc="1+" numofcon="0">
  03. <fpa symbol="Y"/>
  <floatslot id="1" role="S" occno="first"/>
  <optionaltext>
    <choosetext>
      <variant>také</variant>
      <variant>rovněž</variant>
    </choosetext>
  </optionaltext>
  <literal role="S" typeofphrase="V"/>.
  <fpa symbol="Z"/>
</fp>

<fp id="fp4" quantifier="FUI" numofant="1+" numofsuc="1+" numofcon="1+">
  04. <fpa symbol="Y"/>
  <floatslot id="1" role="S" occno="first"/>
  <optionaltext>
    <choosetext>
      <variant>také</variant>
      <variant>rovněž</variant>
    </choosetext>
  </optionaltext>
  <literal role="S" typeofphrase="V"/>.
  <fpa symbol="Z"/>
 <fpa symbol="C"/>
</fp>



<fp id="fp5" quantifier="FUI" numofant="1+" numofsuc="1+" numofcon="0">
  05. <fpa symbol="Y" case="1" number="pl"/>
  <floatslot id="1" role="S" occno="first"/>
  <optionaltext>
    <choosetext>
      <variant>také</variant>
      <variant>rovněž</variant>
    </choosetext>
  </optionaltext>
  <literal role="S" typeofphrase="V" number="pl"/>.
  <fpa symbol="Z"/>
</fp>

<fp id="fp6" quantifier="FUI" numofant="1+" numofsuc="1+" numofcon="1+">
  06. <fpa symbol="Y" case="1" number="pl"/>
  <floatslot id="1" role="S" occno="first"/>
  <optionaltext>
    <choosetext>
      <variant>také</variant>
      <variant>rovněž</variant>
    </choosetext>
  </optionaltext>
  <literal role="S" typeofphrase="V" number="pl"/>.
  <fpa symbol="Z"/>
  <fpa symbol="C"/>
</fp>

<fp id="fp7" quantifier="FUI" numofant="1+" numofsuc="1+" numofcon="0">
  07. <fpa symbol="X"/>
  <fpa symbol="Y" case="2" number="pl"/>
  <floatslot id="1" role="S" occno="first"/>
  <optionaltext>
    <choosetext>
      <variant>také</variant>
      <variant>rovněž</variant>
    </choosetext>
  </optionaltext>
  <literal role="S" typeofphrase="V" number="qpl"/>.
</fp>

<fp id="fp8" quantifier="FUI" numofant="1+" numofsuc="1+" numofcon="1+">
  08. <fpa symbol="X"/>
  <fpa symbol="Y" case="2" number="pl"/>
  <floatslot id="1" role="S" occno="first"/>
  <optionaltext>
    <choosetext>
      <variant>také</variant>
      <variant>rovněž</variant>
    </choosetext>
  </optionaltext>
  <literal role="S" typeofphrase="V" number="qpl"/>.
 <fpa symbol="C"/>
</fp>

<fp id="fp9" quantifier="FUI" numofant="1+" numofsuc="1+" numofcon="0">
  09. <fpa symbol="X"/>
  <fpa symbol="Y" case="2" number="pl"/> vykazuje
  <optionaltext>
    <choosetext>
      <variant>také</variant>
      <variant>rovněž</variant>
    </choosetext>
  </optionaltext>
  <literal role="S" typeofphrase="N" case="4"/>.
</fp>

<fp id="fp10" quantifier="FUI" numofant="1+" numofsuc="1+" numofcon="1+">
  10. <fpa symbol="X"/>
  <fpa symbol="Y" case="2" number="pl"/> vykazuje
  <optionaltext>
    <choosetext>
      <variant>také</variant>
      <variant>rovněž</variant>
    </choosetext>
  </optionaltext>
  <literal role="S" typeofphrase="N" case="4"/>.
 <fpa symbol="C"/>
</fp>


<fp id="fp11" quantifier="FUI" numofant="1+" numofsuc="1+" numofcon="0">
  11. Pro <fpa symbol="Y" case="4" number="pl"/> je charakteristické, že
  <floatslot id="1" role="S" occno="first"/>
  <optionaltext>
    <choosetext>
      <variant>také</variant>
      <variant>rovněž</variant>
    </choosetext>
  </optionaltext>
  <literal role="S" typeofphrase="V" number="pl"/>.
  (<fpa symbol="Z"/>)
</fp>

<fp id="fp12" quantifier="FUI" numofant="1+" numofsuc="1+" numofcon="1+">
  12. Pro <fpa symbol="Y" case="4" number="pl"/> je charakteristické, že
  <floatslot id="1" role="S" occno="first"/>
  <optionaltext>
    <choosetext>
      <variant>také</variant>
      <variant>rovněž</variant>
    </choosetext>
  </optionaltext>
  <literal role="S" typeofphrase="V" number="pl"/>.
  (<fpa symbol="Z"/>)
  <fpa symbol="C"/>
</fp>

<fp id="fp13" quantifier="FUI" numofant="2+" numofsuc="1+" numofcon="0">
  13. Kombinace <literal role="A" typeofphrase="N" case="2"/> a
  <literal role="A" typeofphrase="N" case="2"/> implikuje
  <literal role="S" typeofphrase="N" case="4"/>.
  <fpa symbol="Z"/>
</fp>

<fp id="fp14" quantifier="FUI" numofant="2+" numofsuc="1+" numofcon="1+">
  14. Kombinace <literal role="A" typeofphrase="N" case="2"/> a
  <literal role="A" typeofphrase="N" case="2"/> implikuje
  <literal role="S" typeofphrase="N" case="4"/>.
  <fpa symbol="Z"/>
  <fpa symbol="C"/>
</fp>

<!-- formulation patterns for Above Average -->

<fp id="fp101" quantifier="AAI" numofant="1+" numofsuc="1+" numofcon="0">
  01. Frekvence <literal role="S" typeofphrase="N" case="2"/>
  je o <param name="P"/> % vyšší mezi <fpa symbol="Y" case="7" number="pl"/>
  než v celé kolekci.
</fp>

<fp id="fp102" quantifier="AAI" numofant="1+" numofsuc="1+" numofcon="1+">
  02. Frekvence <literal role="S" typeofphrase="N" case="2"/>
  je o <param name="P"/> % vyšší mezi <fpa symbol="Y" case="7" number="pl"/>
  než v celé kolekci. Platí pro <param name="B"/> <ename symbol="E" case="2" number="pl"/>
  <ename symbol="Erel" number="pl"/> splňuji tyto podmínky:
    <ename symbol="E" case="1" number="sg"/>
	<literal role="C" typeofphrase="V"/>.
</fp>

<fp id="fp103" quantifier="AAI" numofant="1+" numofsuc="1+" numofcon="0">
  03. Frekvence
 <ename symbol="E" number="pl" case="2"/>,
 <ename symbol="Erel" number="pl"/>
 <literal role="S" typeofphrase="V" number="pl"/>
  je o <param name="P"/> % vyšší mezi <fpa symbol="Y" case="7" number="pl"/>
  než v celé kolekci.
</fp>

<fp id="fp104" quantifier="AAI" numofant="1+" numofsuc="1+" numofcon="1+">
  04. Frekvence
  <ename symbol="E" number="pl" case="2"/>,
  <ename symbol="Erel" number="pl"/>
  <literal role="S" typeofphrase="V" number="pl"/>
  je o <param name="P"/> % vyšší mezi <fpa symbol="Y" case="7" number="pl"/>
  než v celé kolekci. Platí pro <param name="B"/> <ename symbol="E" case="2" number="pl"/>
  <ename symbol="Erel" number="pl"/> splňuji tyto podmínky:
    <ename symbol="E" case="1" number="sg"/>
	<literal role="C" typeofphrase="V"/>.
</fp>


<!-- formulation patterns for Double Founded Implication -->

<fp id="fp201" quantifier="DFUI" numofant="1+" numofsuc="1+" numofcon="0">
  201. Z celkového počtu
	<param name="T"/>
	<ename symbol="E" case="2" number="pl"/>,
	<ename symbol="Erel" number="pl"/>
	<floatslot id="1" role="A" occno="first"/>
	<literal role="A" typeofphrase="V" number="pl"/>
	nebo
	<literal role="S" typeofphrase="V" number="pl"/>,
	<param name="P"/>% (konkrétně <param name="B"/>)
	<ename symbol="E" case="2" number="pl"/>
	
	<literal role="A" typeofphrase="V" number="pl"/>
	a zároveň
	<literal role="S" typeofphrase="V" number="pl"/>.
</fp>

<fp id="fp202" quantifier="DFUI" numofant="1+" numofsuc="1+" numofcon="1+">
  202.  Z celkového počtu
	<param name="T"/>
	<ename symbol="E" case="2" number="pl"/>,
	<ename symbol="Erel" number="pl"/>
	<floatslot id="1" role="A" occno="first"/>
	<literal role="A" typeofphrase="V" number="pl"/>
	nebo
	<literal role="S" typeofphrase="V" number="pl"/>,
	<param name="P"/>% (konkrétně <param name="B"/>)
	<ename symbol="E" case="2" number="pl"/>
	
	<literal role="A" typeofphrase="V" number="pl"/>
	a zároveň
	<literal role="S" typeofphrase="V" number="pl"/>.
	<fpa symbol="C"/>
</fp>

<fp id="fp203" quantifier="DFUI" numofant="1+" numofsuc="1+" numofcon="0">
  203. Z celkového počtu
	<param name="T"/>
	<fpa symbol="Y" case="2" number="pl"/>
	nebo
	<literal role="S" typeofphrase="V" number="pl"/>,
	<param name="P"/>% (konkrétně <param name="B"/>)
	<ename symbol="E" case="2" number="pl"/>
	
	<literal role="A" typeofphrase="V" number="pl"/>
	a zároveň
	<literal role="S" typeofphrase="V" number="pl"/>.
</fp>


<fp id="fp204" quantifier="DFUI" numofant="1+" numofsuc="1+" numofcon="1+">
  204.  Z celkového počtu
	<param name="T"/>
	<fpa symbol="Y" case="2" number="pl"/>
	nebo
	<literal role="S" typeofphrase="V" number="pl"/>,
	<param name="P"/>% (konkrétně <param name="B"/>)
	<ename symbol="E" case="2" number="pl"/>
	
	<literal role="A" typeofphrase="V" number="pl"/>
	a zároveň
	<literal role="S" typeofphrase="V" number="pl"/>.
	<fpa symbol="C"/>
</fp>

</formulationpatterns>