<?xml version="1.0" encoding="utf-8"?>
<!DOCTYPE formulationpatterns PUBLIC "-//LISp-Miner//DTD AR2NL 1.2//EN"
	"http://lispminer.vse.cz/dtd/ar2nl-1.2.dtd">

<formulationpatterns>

<fp id="fp1" quantifier="FUI" numofant="1+" numofsuc="1+" numofcon="0" show="yes">
  <choosetext>
    <variant>This fact</variant>
    <variant>This hypothesis</variant>
    <variant>This rule</variant>
  </choosetext>  
  <fpa symbol="X"/>
  observed
  <ename symbol="E" number="pl"/>
  show this relation: if the
  <ename symbol="E"/>
  <literal role="A" typeofphrase="V"/>
  , then
  <ename symbol="Epers"/>
  <optionaltext>also</optionaltext>
  <literal role="S" typeofphrase="V"/>
  .
</fp>

<fp id="fp2" quantifier="FUI" numofant="1+" numofsuc="1+" numofcon="1+" show="yes">
  <fpa symbol="X"/>
  observed
  <ename symbol="E" number="pl"/>
  show this relation: if the
  <ename symbol="E"/>
  <literal role="A" typeofphrase="V"/>
  , then
  <ename symbol="Epers"/>
  <optionaltext>also</optionaltext>
  <literal role="S" typeofphrase="V"/>
  .
  <fpa symbol="C"/>
</fp>

<fp id="fp3" quantifier="FUI" numofant="1+" numofsuc="1+" numofcon="0" show="yes">
   <ename symbol="Eindefart"/>
  <fpa symbol="Y"/>
  <optionaltext>also</optionaltext>
  <literal role="S" typeofphrase="V"/>
  .
  <fpa symbol="Z"/>
 
</fp>

<fp id="fp4" quantifier="FUI" numofant="1+" numofsuc="1+" numofcon="1+" show="yes">
  <ename symbol="Eindefart"/>
  <fpa symbol="Y"/>
  <optionaltext>also</optionaltext>
  <literal role="S" typeofphrase="V"/>
  .
  <fpa symbol="Z"/>
  <fpa symbol="C"/>
</fp>

<fp id="fp5" quantifier="FUI" numofant="1+" numofsuc="1+" numofcon="0" show="yes">
  <fpa symbol="Y" number="pl"/>
  <optionaltext>also</optionaltext>
  <literal role="S" typeofphrase="V" number="pl"/>
  .
  <fpa symbol="Z"/>
</fp>

<fp id="fp6" quantifier="FUI" numofant="1+" numofsuc="1+" numofcon="1+" show="yes">
  <fpa symbol="Y" number="pl"/>
  <optionaltext>also</optionaltext>
  <literal role="S" typeofphrase="V" number="pl"/>
  .
  <fpa symbol="Z"/>
  <fpa symbol="C"/>
</fp>

<fp id="fp7" quantifier="FUI" numofant="1+" numofsuc="1+" numofcon="0" show="yes">
  <fpa symbol="X"/>
  <fpa symbol="Y" number="pl"/>
  <optionaltext>also</optionaltext>
  <literal role="S" typeofphrase="V" number="pl"/>
  .
</fp>

<fp id="fp8" quantifier="FUI" numofant="1+" numofsuc="1+" numofcon="1+" show="yes">
  <fpa symbol="X"/>
  <fpa symbol="Y" number="pl"/>
  <optionaltext>also</optionaltext>
  <literal role="S" typeofphrase="V" number="pl"/>
  .
  <fpa symbol="C"/>
</fp>

<fp id="fp9" quantifier="FUI" numofant="1+" numofsuc="1+" numofcon="0" show="yes">
  It is characteristic for the
  <fpa symbol="Y" number="pl"/>
  that they also
  <literal role="S" typeofphrase="V" number="pl"/>
  .(
  <fpa symbol="Z"/>
  )
</fp>

<fp id="fp10" quantifier="FUI" numofant="1+" numofsuc="1+" numofcon="1+" show="yes">
  It is characteristic for the
  <fpa symbol="Y" number="pl"/>
  that they also
  <literal role="S" typeofphrase="V" number="pl"/>
  .(
  <fpa symbol="Z"/>
  )
  <fpa symbol="C"/>
</fp>

<fp id="fp11" quantifier="FUI" numofant="2+" numofsuc="1+" numofcon="0" show="yes">
  A combination of
  <literal role="A" typeofphrase="N"/>
  and
  <literal role="A" typeofphrase="N"/>
  implies
  <literal role="S" typeofphrase="N"/>
  .
  <fpa symbol="Z"/>
</fp>

<fp id="fp12" quantifier="FUI" numofant="2+" numofsuc="1+" numofcon="1+" show="yes">
  A combination of
  <literal role="A" typeofphrase="N"/>
  and
  <literal role="A" typeofphrase="N"/>
  implies
  <literal role="S" typeofphrase="N"/>
  .
  <fpa symbol="Z"/>
  <fpa symbol="C"/>
</fp>

<!-- above average -->

<fp id="fp101" quantifier="AAI" numofant="1+" numofsuc="1+" numofcon="0" show="yes">
  The relative frequency of
  <literal role="S" typeofphrase="N"/>
  is by
  <param name="P"/>
  higher among the
  <fpa symbol="Y" number="pl"/>
  than in the whole collection. (There are 
  <param name="B"/>
  <ename symbol="E" number="pl"/>
  satisfying all the conditions.)
</fp>

<fp id="fp102" quantifier="AAI" numofant="1+" numofsuc="1+" numofcon="1+" show="yes">
  The relative frequency of
  <literal role="S" typeofphrase="N"/>
  is by 
  <param name="P"/>
  higher among the
  <fpa symbol="Y" number="pl"/>
  than in the whole collection. (There are
  <param name="B"/>
  <ename symbol="E" number="pl"/>
  satisfying all the conditions.)
  <fpa symbol="C"/>
</fp>


<fp id="fp103" quantifier="AAI" numofant="1+" numofsuc="1+" numofcon="0" show="yes">
  The relative frequency of
  <ename symbol="E" number="pl"/>
  that 
  <literal role="S" typeofphrase="V" number="pl"/>
  is by
  <param name="P"/>
  higher among the
  <fpa symbol="Y" number="pl"/>
  than in the whole collection. (There are
  <param name="B"/>
  <ename symbol="E" number="pl"/>
  satisfying all the conditions.)
</fp>

<fp id="fp104" quantifier="AAI" numofant="1+" numofsuc="1+" numofcon="1+" show="yes">
  The relative frequency of 
  <ename symbol="E" number="pl"/>
  that 
  <literal role="S" typeofphrase="V" number="pl"/>
  is by
  <param name="P"/>
  higher among the
  <fpa symbol="Y" number="pl"/>
  than in the whole collection. (There are
  <param name="B"/>
  <ename symbol="E" number="pl"/>
  satisfying all the conditions.)
  <fpa symbol="C"/>
</fp>


<!-- formulation patterns for Double Founded Implication -->

<fp id="fp201" quantifier="DFUI" numofant="1+" numofsuc="1+" numofcon="0" show="yes">
  From the total amount of
  <param name="T"/>
  <ename symbol="E" number="pl"/>
  , that
  <floatslot id="1" role="A" occno="first"/>
  <literal role="A" typeofphrase="V" number="pl"/>
  or
  <literal role="S" typeofphrase="V" number="pl"/>
  ,
  <param name="P"/>
  % (i.e.
  <param name="B"/>
  )
  <ename symbol="E" case="2" number="pl"/>
  <literal role="A" typeofphrase="V" number="pl"/>
  and simultaneously 
  <literal role="S" typeofphrase="V" number="pl"/>
  .
</fp>

<fp id="fp202" quantifier="DFUI" numofant="1+" numofsuc="1+" numofcon="1+" show="yes">
  From the total amount of
  <param name="T"/>
  <ename symbol="E" number="pl"/>
  , that
  <floatslot id="1" role="A" occno="first"/>
  <literal role="A" typeofphrase="V" number="pl"/>
  or
  <literal role="S" typeofphrase="V" number="pl"/>
  ,
  <param name="P"/>
  % (i.e.
  <param name="B"/>
  )
  <ename symbol="E" case="2" number="pl"/>
  <literal role="A" typeofphrase="V" number="pl"/>
  and simultaneously
  <literal role="S" typeofphrase="V" number="pl"/>
  .
  <fpa symbol="C"/>
</fp>


</formulationpatterns>