<?xml version="1.0" encoding="utf-8"?>
<!DOCTYPE auxiliarysymbols PUBLIC "-//LISp-Miner//DTD AR2NL 1.2//EN"
	"http://lispminer.vse.cz/dtd/ar2nl-1.2.dtd">

<auxiliarysymbols>

<fpadata id="fpa1" symbol="X" numofant="1+" numofsuc="1+">
  <param name="P"/> % (i.e. <param name="B"/>) of the total of
  <param name="T"/>
</fpadata>

<fpadata id="fpa2" symbol="X" numofant="1+" numofsuc="1+">
  <param name="B"/> (i.e. <param name="P"/> %) of the total of
  <param name="T"/>
</fpadata>

<fpadata id="fpa3" symbol="X" numofant="1+" numofsuc="1+">
  <param name="B"/>, i.e. <param name="P"/> % of the total of
  <param name="T"/>
</fpadata>

<fpadata id="fpa4" symbol="Y" numofant="1+" numofsuc="1+">
  <ename symbol="E"/> that
  <literal role="A" typeofphrase="V" number="_"/>
</fpadata>

<fpadata id="fpa5" symbol="Y" numofant="1+" numofsuc="1+">
  <ename symbol="E"/>
  <literal role="A" typeofphrase="NA"/>
</fpadata>

<fpadata id="fpa6" symbol="Y" numofant="1+" numofsuc="1+">
  <ename symbol="E"/>
  <literal role="A" typeofphrase="R"/>
</fpadata>

<fpadata id="fpa7" symbol="Y" numofant="2+" numofsuc="1+">
  <literal role="A" typeofphrase="L"/>
  <ename symbol="E"/>
  <literal role="A" typeofphrase="R"/>
</fpadata>

<fpadata id="fpa8" symbol="Y" numofant="2+" numofsuc="1+">
  <literal role="A" typeofphrase="L"/>
  <ename symbol="E"/>
  <literal role="A" typeofphrase="NA"/>
</fpadata>

<fpadata id="fpa9" symbol="Y" numofant="1+" numofsuc="1+">
  <literal role="A" typeofphrase="L"/>
  <ename symbol="E"/>
</fpadata>

<fpadata id="fpa10" symbol="Z" numofant="1+" numofsuc="1+">
  <choosetext>
    <variant>This fact</variant>
    <variant>This hypothesis</variant>
    <variant>This rule</variant>
  </choosetext>
  is confirmed by <fpa symbol="X"/> observed <ename symbol="E" number="pl"/>.
</fpadata>

<fpadata id="fpa11" symbol="C" numofant="1+" numofsuc="1+" numofcon="1+">
<choosetext>
  <variant>This fact</variant>
  <variant>This hypothesis</variant>
  <variant>This rule</variant>
</choosetext>
is accepted
<choosetext>
 <variant> on condition that</variant>
 <variant> in this case:</variant>
 <variant> when</variant>
</choosetext>
 <ename symbol="Edefart"/>
 <ename symbol="E" number="sg"/>
 <literal role="C" typeofphrase="V"/>.
</fpadata>

</auxiliarysymbols>