<?xml version="1.0" encoding="utf-8"?>
<!DOCTYPE mvpatterns PUBLIC "-//LISp-Miner//DTD AR2NL 1.2//EN"
	"http://lispminer.vse.cz/dtd/ar2nl-1.2.dtd">

<mvpatterns>

<pattern name="v1">
  <example>walks</example>
  <base>s</base>
  <pl></pl>
  <ptc>ing</ptc>
</pattern>
<pattern name="v1g">
  <example>digs</example>
  <base>s</base>
  <pl></pl>
  <ptc>ging</ptc>
</pattern>
<pattern name="v1l">
  <example>travels</example>
  <base>s</base>
  <pl></pl>
  <ptc>ling</ptc>
</pattern>
<pattern name="v1t">
  <example>sits</example>
  <base>s</base>
  <pl></pl>
  <ptc>ting</ptc>
</pattern>
<pattern name="v2">
  <example>makes</example>
  <base>es</base>
  <pl>e</pl>
  <ptc>ing</ptc>
</pattern>
<pattern name="v2x">
  <example>teaches</example>
  <base>es</base>
  <pl></pl>
  <ptc>ing</ptc>
</pattern>
<pattern name="v3">
  <example>carries</example>
  <base>ies</base>
  <pl>y</pl>
  <ptc>ying</ptc>
</pattern>
<pattern name="v4">
  <example>has</example>
  <base>s</base>
  <pl>ve</pl>
  <ptc>ving</ptc>
</pattern>
<pattern name="v5">
  <example>is</example>
  <base>is</base>
  <pl>are</pl>
  <ptc></ptc>
</pattern>

</mvpatterns>